post_id,type,url,message,timestamp,comments_count,reactions_count,reshare_count,Post ID,author_id,author_name,author_url,author_profile_picture_url,reactions_angry,reactions_care,reactions_haha,reactions_like,reactions_love,reactions_sad,reactions_wow
1408511856935789,post,https://www.facebook.com/groups/361306988322953/posts/1408511856935789/,السلام عليكم ممكن حد ينزل لينك تقديم الازهر أولى ابتدائي هنا عشان هيبدأ ٧/١ بكره يعنى ان شاءالله,01/07/2025,112,84,1,1408511856935789,pfbid0aA8J5HbXqQLYLEYEZHDtyP4THxa5GGyNp23WXawreCJ5Rin17vVto9sHponz3Yrjl,Loolo Alaa,https://www.facebook.com/loolo.alaa.3,https://scontent.fxap1-2.fna.fbcdn.net/v/t1.6435-1/64224554_129910498214110_5208232176700620800_n.jpg?stp=cp0_dst-jpg_s48x48_tt6&_nc_cat=101&ccb=1-7&_nc_sid=e99d92&_nc_ohc=_gIg3ZLL51AQ7kNvwGz-FdK&_nc_oc=AdkTjGzX6JS3a6jjmJoQE9m2hNwOQJMvKg6NMrxJXoxKrisiAp81gZeNcar7WAB62cg&_nc_zt=24&_nc_ht=scontent.fxap1-2.fna&_nc_gid=yJrVlHARv-78Tqer9O4fMA&oh=00_AfSV1CvA3SLntmNs4H35jQSLVWIolcTTfMJ6M5Sy9dh7jg&oe=6891DCD9,0,0,0,84,0,0,0
1078742446945775,post,https://www.facebook.com/groups/170199277800101/posts/1078742446945775/,"في ناس تقول من المتوقع أن التمريض السنادى ياخد من 455
ومن اول 87%
هل دا صح",06/07/2025,8,13,0,1078742446945775,2066115643911237,Anonymous participant,,https://scontent.fxap1-1.fna.fbcdn.net/v/t39.35477-6/480482336_9286751958060136_3985864174076210201_n.jpg?stp=cp0_dst-jpg_s50x50_tt6&_nc_cat=100&ccb=1-7&_nc_sid=ee2d7f&_nc_ohc=KSfFp15aMyMQ7kNvwHKogoK&_nc_oc=Adkro6seSjfNx-dmcaOItFfO2Zzxf52YxMyzVpT3KH6S1Xx-U0HDPcmY3tMN1hPXO_8&_nc_zt=14&_nc_ht=scontent.fxap1-1.fna&_nc_gid=yJrVlHARv-78Tqer9O4fMA&oh=00_AfQu12LpqPa6fanP2OvOT3rn9xDXRe6ev7g1WdwhwYljeQ&oe=68703B63,0,0,0,13,0,0,0
1533734617965410,post,https://www.facebook.com/groups/146097226729163/posts/1533734617965410/,نتيجه الشهاده الثانويه الازهريه بتطلع بعد كام يوم من الامتحان,05/07/2025,126,135,0,1533734617965410,1036130408265318,Anonymous participant,,https://scontent.fxap1-1.fna.fbcdn.net/v/t39.35477-6/480772267_8870171503091593_8950035799029425225_n.jpg?stp=cp0_dst-jpg_s50x50_tt6&_nc_cat=107&ccb=1-7&_nc_sid=ee2d7f&_nc_ohc=JxjYoOoSSiEQ7kNvwEa3dG-&_nc_oc=AdmMz4qzKi_-_WCrPXw6uc8_iWAcyG6C5Cx84Ta1lQik2YxRnsn6BfjtSQ1-MeVCFAo&_nc_zt=14&_nc_ht=scontent.fxap1-1.fna&_nc_gid=yJrVlHARv-78Tqer9O4fMA&oh=00_AfQeQEPjB_Tnf14MSFpqMIP8FTI8UsvOcZvvncr9_BQScQ&oe=68703B3B,0,0,2,132,0,1,0
1791831958035152,post,https://www.facebook.com/groups/1633966240488392/posts/1791831958035152/,"محمود أبوطالب mahmoud abotaleb 
انت فين يا نجم الجيل انت فين من اخبارك الاونطه
قلت إن الالهه سلامه داوود طلب من الجهاز المركزي للتنظيم والإدارة 9 الاف درجه ماليه لتعين الاول والتاني معيدين وطلع كذب
قلت إنه هيتم تجديد للعاملين بالحصه وطلع كذب 
قلت إن شيخ الأزهر هيصرف 200 يوم مكافاه ب العاملين بالحصه وطلع اونطه 
قلت قريبا في الازهر عمل مسابقه تثبيت للعاملين بالحصه وطلع كلام في الهوا
وبتزعل لما بنقول سلامه و صديق ضدد الاوائل ومش عاوزين حد يتعين في المعاهد ولا كليات وكان بنقبض من جيوب ابوهم",05/07/2025,22,22,0,1791831958035152,711288058199475,Anonymous participant,,https://scontent.fpmi4-1.fna.fbcdn.net/v/t39.35477-6/480295029_8309457052490122_5764708506034413611_n.jpg?stp=cp0_dst-jpg_s50x50_tt6&_nc_cat=1&ccb=1-7&_nc_sid=ee2d7f&_nc_ohc=jEJB-M9JUT8Q7kNvwHudFjq&_nc_oc=Adn2fPrNydS4FzyqycgXsPNlXlwqcwl3W63OVGUZ-Aeo87AHg59rinBs8NUDkP18Oq8&_nc_zt=14&_nc_ht=scontent.fpmi4-1.fna&_nc_gid=XzAogpYIhSvXvsRDkffylQ&oh=00_AfTLMmm5Cp3bAlF_Aq0e-u-dA_QOerBW8-3cNgj0ldbg0Q&oe=6870462D,0,0,0,22,0,0,0
1533616344643904,post,https://www.facebook.com/groups/146097226729163/posts/1533616344643904/,مدخلتش الامتحان عشان تأخرت ربع ساعه حسبي الله ونعم الوكيل وقعت بالمكنه ع الطريق وتأخرت ع امتحاني رائيس الدور يحلف بالطلاق اني مش هدخل لي كده بجد هوه ده الأزهر  إلي الناس بتفتخر بيه ضيعو كل حاجه من اول السنه وتعب طول السنه كلو ع فاضي امتحانات الدور التاني امته,05/07/2025,96,127,0,1533616344643904,100058881572173,Adham A Sayed,https://www.facebook.com/adham.a.sayed,https://scontent.fpmi4-1.fna.fbcdn.net/v/t39.30808-1/504426403_1087734339865942_7718566219089822939_n.jpg?stp=cp0_dst-jpg_s48x48_tt6&_nc_cat=109&ccb=1-7&_nc_sid=1d2534&_nc_ohc=-wyDV5TRiVcQ7kNvwH48eaQ&_nc_oc=AdnhGs23LucHfh-RKMDpxF1ROrrm7wEU9tm9qvqNG3wW7p90J0cWZQdkoeNVgHF7074&_nc_zt=24&_nc_ht=scontent.fpmi4-1.fna&_nc_gid=XzAogpYIhSvXvsRDkffylQ&oh=00_AfTCsCXDLnLOYxSnaayLpbpsy021W22CI1FnBZc1LJ4jMQ&oe=68705ACB,1,0,0,60,1,65,0
10051398284929245,post,https://www.facebook.com/groups/school.elazhar.elnamozagy.15may/posts/10051398284929245/,"السلام عليكم ورحمه الله وبركاته 
انا دلوقتي قدمت لبنتي من علي النت 
ازهري نموذجي فالمدينه المنوره 
وهو كتب نموذجي بس ماكتبش نموذجي عادي 
ودلوقتي قالي استني الكشوفات 
هي عندها اربع سنين ونصف 
المفروض اعمل إيه دلوقتي 
وهل فيه حاجه اقدر اعملها دلوقتي 
وجزاكم الله خيرا",05/07/2025,10,4,0,10051398284929245,pfbid02vdZqqfvtZmA8WdwDzFbLgZi2ymNv1eP2PWwgqWxPTGjjv9bUmciifQYB6LJyu7Qml,نور الجنه,https://www.facebook.com/nwr.aljnh.607156,https://scontent.fsgn8-4.fna.fbcdn.net/v/t39.30808-1/499870819_2309782896082258_5785823422582431379_n.jpg?stp=cp0_dst-jpg_s48x48_tt6&_nc_cat=107&ccb=1-7&_nc_sid=e99d92&_nc_ohc=LqhUtqvGZ4IQ7kNvwFtfQ6l&_nc_oc=AdmkoDO63JbsDEIXA_OPYHef0iOq5eL6Ef0jfBgw2qiXWLfY3oRhupPuTWQDtwVJm0Y&_nc_zt=24&_nc_ht=scontent.fsgn8-4.fna&_nc_gid=iP4qpDJHvD0375l_l_8WGg&oh=00_AfTXHDCbAdUPVEBdp0WMk3VKm2nCsyeYQczMsw5UG2zIRw&oe=68706E19,0,0,0,4,0,0,0
708417085368172,post,https://www.facebook.com/permalink.php?story_fbid=pfbid024xH1JgkuPkJoixfxUtnkTPDj46hXs2hv74sYgBZxqitLLxqYq4ZDPVoC7Km7zjdjl&id=100085996616523,"الأول على الجمهوريه ثانوي أزهري بمجموع 650 من 650 عام 2018  يعنى 100 % من غير المستوي الرفيع إسمه محمد حسام حسن حافظ عارفين يعنى إيه ؟ يعنى الشاب ده جاب الدرجة النهائية فى 16ماده بيدرسهم فى الثانويه الأزهرية هما الكيمياء والفيزياء والأحياء والإنجليزي الجبر والهندسه الفراغيه الفقه القرآن الحديث والتفسير البلاغه الصرف النحو التوحيد الأدب والنصوص التفاضل والتكامل الديناميكا والاستاتيكا
          هنيئا له وألف مبروووك عليك التفوق 
من السنين الماضية عام 2016
#تعديل 
الطالب محمد حسام في مرحلة إنه طبيب امتياز  ربنا يوفقه ويكرمه يارب في حياته العملية القادمة",05/07/2025,17992,119701,6568,708417085368172,100085996616523,أخبارجامعة الأزهر,https://www.facebook.com/people/%D8%A3%D8%AE%D8%A8%D8%A7%D8%B1%D8%AC%D8%A7%D9%85%D8%B9%D8%A9-%D8%A7%D9%84%D8%A3%D8%B2%D9%87%D8%B1/100085996616523/,https://scontent.fsgn8-3.fna.fbcdn.net/v/t39.30808-1/382111371_276862778523607_4068454211255785621_n.jpg?stp=cp0_dst-jpg_s80x80_tt6&_nc_cat=1&ccb=1-7&_nc_sid=2d3e12&_nc_ohc=PqIH-xQQF70Q7kNvwFHBNre&_nc_oc=Adlji2_4SyFTDoMGCNqsLi4F5TH1xYktv-tFwgb6cwWLxPiYHpGKxt2bEY60WY2ovhc&_nc_zt=24&_nc_ht=scontent.fsgn8-3.fna&_nc_gid=iP4qpDJHvD0375l_l_8WGg&oh=00_AfQDmTz-mjGeUk-yTuZiMJvPdzZxAuf_NnWcOgnhIRFToQ&oe=68704157,16,7752,85,78954,32839,18,37
1791559441395737,post,https://www.facebook.com/groups/1633966240488392/posts/1791559441395737/,"انا خريجة تربية شعبة عامة كنت شغالة بالحصة عربي 

ينفع اقدم ف مسابقة الشرعي ولا ايه أنا مكتوب عندي شعبة عامة  علوم شرعية وعربية",05/07/2025,10,6,0,1791559441395737,1128946075376068,Anonymous participant,,https://scontent.fsgn8-3.fna.fbcdn.net/v/t39.35477-6/480772267_8870171503091593_8950035799029425225_n.jpg?stp=cp0_dst-jpg_s50x50_tt6&_nc_cat=1&ccb=1-7&_nc_sid=ee2d7f&_nc_ohc=JxjYoOoSSiEQ7kNvwFMIPpJ&_nc_oc=AdklVIB2XtYwE2lc4geb7i64RAi6uojpjlcIk0zAjSjSC7S15_ghbzQTYsfHglocFFw&_nc_zt=14&_nc_ht=scontent.fsgn8-3.fna&_nc_gid=iP4qpDJHvD0375l_l_8WGg&oh=00_AfQejlMB0S-vOHDetkyCNOvQ3-f9qIyGcFdcGgRImJLDPw&oe=68703B3B,0,0,0,6,0,0,0
1078504493636237,post,https://www.facebook.com/groups/170199277800101/posts/1078504493636237/,السلام عليكم انا بنتي جايبه 360من 490لو عدلت المعادله مجموعها حيبقا كام ممكن حد يفيدني بالله عليكم,05/07/2025,18,7,0,1078504493636237,pfbid02fZEM77XE39qWaK28jeKWkZYB4ujoGWxKyyqmG2Vop8qEMcooBztYzXKRKyApxusWl,OM Adham,https://www.facebook.com/people/OM-Adham/pfbid02fZEM77XE39qWaK28jeKWkZYB4ujoGWxKyyqmG2Vop8qEMcooBztYzXKRKyApxusWl/,https://scontent.fhan4-4.fna.fbcdn.net/v/t39.30808-1/508152557_122143302290616880_4784110058757808286_n.jpg?stp=c0.36.1080.1080a_cp0_dst-jpg_s48x48_tt6&_nc_cat=102&ccb=1-7&_nc_sid=e99d92&_nc_ohc=j0oCPga3z7YQ7kNvwHuWohc&_nc_oc=AdntlfMaODwom_C6yadurKGMXbkt30Juc1g4nSpPOAaKzhzvNgQNl0jSHB0GMVW67vc&_nc_zt=24&_nc_ht=scontent.fhan4-4.fna&_nc_gid=E4Z3vzsI0bYi06Ffnp02aQ&oh=00_AfTBiJRUqPb_21F-K5pAhJL7Cq4-Uv-2h12gA6mCSdvqfQ&oe=68706778,0,0,0,7,0,0,0
1533652564640282,post,https://www.facebook.com/groups/146097226729163/posts/1533652564640282/,"يا أولياء الأمور انهارده طالب اتمسك بسماعه بق يلطم ويقول 

انه ماضي وصل امانه ب ١٠٠٠٠ عشان ياخد السماعه وإيجار يومي من ٣٠٠ ل ٦٠٠ خلي بالكم من أولادكم",05/07/2025,37,86,3,1533652564640282,694551536723614,GreenToucan496,,https://scontent.fhan3-3.fna.fbcdn.net/v/t39.35477-6/480424763_9499112296775885_2098664702354381518_n.jpg?stp=cp0_dst-jpg_s50x50_tt6&_nc_cat=1&ccb=1-7&_nc_sid=ee2d7f&_nc_ohc=AWZvjkN331MQ7kNvwHLvfL4&_nc_oc=Adm4o0q76AvrIZsFZU0wF1ol6bD9mhf9oYPmpsLUphc11PaziG9BbmmjSbEv3mf2BWw&_nc_zt=14&_nc_ht=scontent.fhan3-3.fna&_nc_gid=E4Z3vzsI0bYi06Ffnp02aQ&oh=00_AfQyVw6Jd2HHFr7FinTnC5toAIltkL2YeC4yo-ihiyFBEg&oe=68706F93,0,0,1,52,0,31,2
4012274862368774,post,https://www.facebook.com/groups/1948811378715143/posts/4012274862368774/,حد يحل,05/07/2025,68,51,3,4012274862368774,1826238944591205,Anonymous participant,,https://scontent.fhan3-3.fna.fbcdn.net/v/t39.35477-6/480601864_23875370292052714_2305713118741625887_n.jpg?stp=cp0_dst-jpg_s50x50_tt6&_nc_cat=1&ccb=1-7&_nc_sid=ee2d7f&_nc_ohc=YOqRxIHjdvoQ7kNvwGO80DM&_nc_oc=Adky6XNp_0Jf7-yy1PEr22z1I2Vw4CGeuyJhQRBMDDL6KCPm6Mq1d08JwHajN7IXW3M&_nc_zt=14&_nc_ht=scontent.fhan3-3.fna&_nc_gid=E4Z3vzsI0bYi06Ffnp02aQ&oh=00_AfT9vh0kD821cUkeHnr6xIxpck_OB-IP39gwOo8hBkko-A&oe=687063AF,0,1,0,41,9,0,0
4012647352331525,post,https://www.facebook.com/groups/1948811378715143/posts/4012647352331525/,مش هصيح بس عاوزة حد يطمني انا قرات وكتبت  وزكرت وكل حاجه بتتبخر اعمل ايه .والناس اللي قبل كده يطمنونا بالله عليكم .يعني لو جيه سؤال مش عارفينه نعمل ايه,05/07/2025,54,39,0,4012647352331525,1433770621401087,Anonymous participant,,https://scontent-eze1-2.xx.fbcdn.net/v/t39.35477-6/480208111_9231097583651002_1085264795773632553_n.jpg?stp=cp0_dst-jpg_s50x50_tt6&_nc_cat=1&ccb=1-7&_nc_sid=ee2d7f&_nc_ohc=Sz0GWN4p0vYQ7kNvwFAS-C8&_nc_oc=AdlKkQW1_IiDkWZS5RzwxGxV6M0BwQQLo2kzEjRRMWoYbtPpN0rSx7Wg0Ot_jspVIwQ&_nc_zt=14&_nc_ht=scontent-eze1-2.xx&_nc_gid=uCAmIFxpE1tId3kl-89SRA&oh=00_AfR5d9ZVeeLo6SrTfrasvLro-YVfvNLcklSbghHrskiQ_g&oe=68706498,0,0,0,28,0,11,0
4012729792323281,post,https://www.facebook.com/groups/1948811378715143/posts/4012729792323281/,"الحل ده كده صح ؟!
اذاكر واحفظ ع كده أنا حليته وعايزة اتأكد منه
#Sokara",05/07/2025,10,18,5,4012729792323281,1229588878417387,Anonymous participant,,https://scontent-eze1-2.xx.fbcdn.net/v/t39.35477-6/480208111_9231097583651002_1085264795773632553_n.jpg?stp=cp0_dst-jpg_s50x50_tt6&_nc_cat=1&ccb=1-7&_nc_sid=ee2d7f&_nc_ohc=Sz0GWN4p0vYQ7kNvwFAS-C8&_nc_oc=AdlKkQW1_IiDkWZS5RzwxGxV6M0BwQQLo2kzEjRRMWoYbtPpN0rSx7Wg0Ot_jspVIwQ&_nc_zt=14&_nc_ht=scontent-eze1-2.xx&_nc_gid=uCAmIFxpE1tId3kl-89SRA&oh=00_AfR5d9ZVeeLo6SrTfrasvLro-YVfvNLcklSbghHrskiQ_g&oe=68706498,0,0,0,15,3,0,0
4009592335970360,post,https://www.facebook.com/groups/1948811378715143/posts/4009592335970360/,"بما إن بدأت التقديمات
وكثير من الطلبة بيسأل عن الموضوع ده 
اها الفرق بين الأزهر والعام 👇🏻👇🏻
مميزات دبلومة العام :-
1- مكونة من 15 مادة فقط .
2- مقسمة على ترمين .
3- المواد اسهل شوية .
عيوب دبلومة العام :-
1- مكونة من 3 مسارات .. لو دخلتى فى واحدة منهم وجاتلك وظيفة فى الاتنين التانيين كأنك معملتيش دبلومة .
2- مكانها بعيد جدا وموصلاتها صعبة جدا .
3- مصاريفها ضخمة جدا جدا ومبالغ فيها جدا وكل شئ فيها اجبارى .
4- التربية العملية بتاعتها بتتعمل فى مدرسة وبالتالى فالحصول عليها صعب شوية .
مميزات دبلومة الازهر :-
1- شاملة لل3 مسارات بتوع العام .
2- مصاريفها اقل بكتير من العام ومفيش اى اجبار على شراء مذكرات او شيتات .
3- العملى بتاعها بتتقيمى من دكاترة فى الكلية نفسها ومش بتروحى مدارس .
4 ـ بتساوى كلية تربية ازهر بعد التخرج وليها نفس مميزاتها .
عيوب دبلومة الازهر :-
1- مكونة من 18 مادة .
2- امتحاناتها آخر السنة فقط .
3- اصعب شوية لانها شاملة ومجالها اوسع من العام .

وانا واحد من الناس اخذت الدبلومة فى الأزهر ، ولو رجع بيا الزمن هخدها فى الأزهر ، لان الأزهر افضل من العام بكثير جدا جدا ( يكفى أنه يشمل الثلاث مسارات )",02/07/2025,122,136,11,4009592335970360,pfbid02BrAsRbEtTACDzLtXe4WPddrB5KR95HX1AZ3u3oyJ1Jvg6X3ncBB4V8mPeJVuphol,رأى سديد,,https://scontent-eze1-1.xx.fbcdn.net/v/t39.30808-1/507582589_122103542228906761_221204433660393832_n.jpg?stp=cp0_dst-jpg_s48x48_tt6&_nc_cat=110&ccb=1-7&_nc_sid=e99d92&_nc_ohc=TGCuwPQtfPIQ7kNvwEltNn7&_nc_oc=Adlll8jE9-YDnQpk6vPOVmWZYuGUJEyl1UkdLIqyaSj3OIB62PpvYT_L-mXuVI6qZYQ&_nc_zt=24&_nc_ht=scontent-eze1-1.xx&_nc_gid=uCAmIFxpE1tId3kl-89SRA&oh=00_AfRk60W03CYqxljd4_HXgjDFXH-jtATD7P7DXy0mnOA70Q&oe=687038FD,0,10,1,91,34,0,0
1078699793616707,post,https://www.facebook.com/groups/170199277800101/posts/1078699793616707/,جماعه بالله عليكم تنسيق دمياط تمريض للشهادة الاعداديه نزل ولا لسه,05/07/2025,21,13,0,1078699793616707,707012412138060,Anonymous participant,,https://scontent.fsgn13-1.fna.fbcdn.net/v/t39.35477-6/480772267_8870171503091593_8950035799029425225_n.jpg?stp=cp0_dst-jpg_s50x50_tt6&_nc_cat=1&ccb=1-7&_nc_sid=ee2d7f&_nc_ohc=JxjYoOoSSiEQ7kNvwFma7PY&_nc_oc=Adnzdv-6yej0Y6Egj4lul98pYx-p3HHCrgQ1ryla3KbOVTeL5FSnrIdBZFqQ2Gy_S9I&_nc_zt=14&_nc_ht=scontent.fsgn13-1.fna&_nc_gid=mLJxOSnR8Gfo3Ec6KXCnRA&oh=00_AfQNMlJwnCXNCutktSoUEdnCLJuso8UkEEvI4j8HGYE9NA&oe=68703B3B,0,0,0,12,1,0,0
1533597071312498,post,https://www.facebook.com/groups/146097226729163/posts/1533597071312498/,"السلام عليكم 
ياريت لو حد عنده معلومة اكيد يطمني بالله عليكم 
امتحان التطبيقيه في سؤال مقالي الخطوات صح بس الناتج الاخير غلط اللي هو كان ٣٧ مطلعاه رقم تاني 
وأكمل بردو عملت في واحده كل الخطوات صح بس الناتج الاخير غلط وكتبته في النقط 😭
ممكن اخد عليهم درجات 
ادعولي ربنا يكرمني في التصحيح علشان خاطر اهلي 😭",05/07/2025,26,37,0,1533597071312498,1889183281643709,Anonymous participant,,https://scontent.fsgn13-1.fna.fbcdn.net/v/t39.35477-6/480772267_8870171503091593_8950035799029425225_n.jpg?stp=cp0_dst-jpg_s50x50_tt6&_nc_cat=1&ccb=1-7&_nc_sid=ee2d7f&_nc_ohc=JxjYoOoSSiEQ7kNvwFma7PY&_nc_oc=Adnzdv-6yej0Y6Egj4lul98pYx-p3HHCrgQ1ryla3KbOVTeL5FSnrIdBZFqQ2Gy_S9I&_nc_zt=14&_nc_ht=scontent.fsgn13-1.fna&_nc_gid=mLJxOSnR8Gfo3Ec6KXCnRA&oh=00_AfQNMlJwnCXNCutktSoUEdnCLJuso8UkEEvI4j8HGYE9NA&oe=68703B3B,0,1,0,28,4,4,0
1533790101293195,post,https://www.facebook.com/groups/146097226729163/posts/1533790101293195/,"لما تلاقى حد بينزف من مناخيرة اياك تخليه ينام على ظهرة ويرجع راسه لورا .. ✋️
انت متعرففش انت كدا بتعمل أى .. انت ممكن تتسب فى انه يتخنق اويبلع الدم دا و يتسبب فى مشكله 

طب اى التصرف السليم بقا :
1 - هتقعده بشكل مستقيم وتميل راسه لقدام شوية. 
2 - تضغط على الجزء الامامى (الطرى) من مناخيرة لمده10 دقايق وخلال الوقت دا يتنفس هو من بقه.
3 - تحط كيس تلج على مناخيره علشان التلج بيعمل V.C.",05/07/2025,3,42,19,1533790101293195,pfbid08aqNpenYig5dsEoJRZsha8bKA9MzJZLHpdbqpXwbSYw3eWXbhrXejDbXof7MxKrUl,Dr-Esmail Lotfy,https://www.facebook.com/people/Dr-Esmail-Lotfy/pfbid08aqNpenYig5dsEoJRZsha8bKA9MzJZLHpdbqpXwbSYw3eWXbhrXejDbXof7MxKrUl/,https://scontent.fsgn3-1.fna.fbcdn.net/v/t39.30808-1/486839085_122100812648821123_1764720787906237204_n.jpg?stp=cp0_dst-jpg_s48x48_tt6&_nc_cat=107&ccb=1-7&_nc_sid=e99d92&_nc_ohc=k1otAyJC1ukQ7kNvwHSSE5Y&_nc_oc=AdkC3JOncreQyWtN8sM51fOPGzEAKU4B_FyGihA2bEISU7WwxT9hhtx7uHxeoJbUUMs&_nc_zt=24&_nc_ht=scontent.fsgn3-1.fna&_nc_gid=mLJxOSnR8Gfo3Ec6KXCnRA&oh=00_AfT1vl1JB9OfbG7Y9je4xOf8SI13tQv7mHIK4Xa9psOvWQ&oe=68706DC3,0,4,0,31,6,0,1
122131319096665804,post,https://www.facebook.com/permalink.php?story_fbid=pfbid0qo7jhgJunPasbvPCiug3ZDpMLinqXmNx4JVaMBrsu6eUpXHf5RYFesCvGdXbTh1Kl&id=61569974124834,"إنا لله وإنا إليه راجعون. 
بقلوب مؤمنة بقضاء الله وقدره، تنعى دفعة طب الأزهر زميلتنا الغالية الطبيبة / زينب عبد الستار عبد الخالق.

نسأل الله أن يتغمدها بواسع رحمته، ويسكنها فسيح جناته، وأن يلهم أهلها وذويها الصبر والسلوان.
اللهم أبدلها دارًا خيرًا من دارها، وأهلاً خيرًا من أهلها، واغسلها بالماء والثلج والبرد، ونقّها من الذنوب والخطايا كما يُنقّى الثوب الأبيض من الدنس، وباعد بينها وبين خطاياها كما باعدت بين المشرق والمغرب، وأدخلها الفردوس الأعلى بلا سابقة سؤال ولا عذاب اللهم اجمل ألمها شفيعًا لها وثبتها عند السؤال يارب العالمين.
اللهم اربط على قلوب أهلها وألهمهم الصبر والرضا.",04/07/2025,170,540,295,122131319096665804,61569974124834,الدفعة 57 طب الأزهر بنات القاهرة,https://www.facebook.com/people/%D8%A7%D9%84%D8%AF%D9%81%D8%B9%D8%A9-57-%D8%B7%D8%A8-%D8%A7%D9%84%D8%A3%D8%B2%D9%87%D8%B1-%D8%A8%D9%86%D8%A7%D8%AA-%D8%A7%D9%84%D9%82%D8%A7%D9%87%D8%B1%D8%A9/61569974124834/,https://scontent.fuio1-2.fna.fbcdn.net/v/t39.30808-1/470153718_122106076238665804_4793126553854840085_n.jpg?stp=cp0_dst-jpg_s80x80_tt6&_nc_cat=106&ccb=1-7&_nc_sid=2d3e12&_nc_ohc=Mt3CxfYhLtgQ7kNvwHMBEXG&_nc_oc=AdkVGGH-HnVMqdFi9xBRCfAieJ26Foa6ZEr01Acw2jh3uap0aFELCXDYSNiF5wmqQ0Q&_nc_zt=24&_nc_ht=scontent.fuio1-2.fna&_nc_gid=ON7KazpH2FcJ448efwoK7A&oh=00_AfQJhH9De5j3JkE8V3KOTZrZnEczaZecMd6eBm7y3EnLEQ&oe=68704863,0,1,0,8,0,531,0
1372372531558508,post,https://www.facebook.com/permalink.php?story_fbid=pfbid0rnnAPTAp86ghJQuF2fCFiKJYwgG4JNYs5geEtexrz6FeMP4cxN7EXX1pP1bzmiJ3l&id=100063573231347,"بكل مشاعر الحزن والأسى، تنعى كلية الطب بنات – جامعة الأزهر برئاسة الأستاذة الدكتورة/ هناء العبيسى عميد الكليه
و الاستاذة الدكتورة/ أمل حجازى وكيل الكليه لشئون التعليم والطلاب
والأستاذة الدكتورة/ سبيله جمعه وكيل الكليه للدراسات العليا والبحوث وجميع اعضاء هيئة التدريس والهيئة المعاونة والإداريين إبنتنا الغالية الطالبة الخلوقة:

زينب عبد الستار عبد الخالق 

التي وافتها المنية  وقد كانت – رحمها الله – مثالًا في الصبر والرضا والإيمان إلى جانب تفوقها العلمي وأخلاقها الرفيعة ومحبة زميلاتها وأساتذتها لها.

لقد ترك رحيلها المفاجئ ألمًا عميقًا في قلوبنا جميعًا ولكننا نحتسبها عند الله من الصابرين المحتسبين.

نسأل الله العلي القدير أن يتغمدها بواسع رحمته ويسكنها فسيح جناته ويلهم أهلها ومحبيها وزميلاتها الصبر والسلوان.

 “إنا لله وإنا إليه راجعون”
اللهم اجعل مرضها كفارة وطهورًا واجعل قبرها روضة من رياض الجنة واربط على قلوب أهلها ومحبيها.",05/07/2025,182,862,35,1372372531558508,100063573231347,كلية الطب بنات الأزهر,https://www.facebook.com/people/%D9%83%D9%84%D9%8A%D8%A9-%D8%A7%D9%84%D8%B7%D8%A8-%D8%A8%D9%86%D8%A7%D8%AA-%D8%A7%D9%84%D8%A3%D8%B2%D9%87%D8%B1/100063573231347/,https://scontent.fepa6-1.fna.fbcdn.net/v/t39.30808-1/308158701_532536398875463_4793199295369203909_n.jpg?stp=cp0_dst-jpg_s80x80_tt6&_nc_cat=103&ccb=1-7&_nc_sid=2d3e12&_nc_ohc=b2OLrB46RZ8Q7kNvwFxVgez&_nc_oc=AdlTwlpylVWZpQmU7jynaWVEFE--Lf0lwo4AHAMaQf8UYBxDYFkr6xcWacGY0HrXZGI&_nc_zt=24&_nc_ht=scontent.fepa6-1.fna&_nc_gid=-ajgD8bW7JRDonmP9yxjQQ&oh=00_AfT_WGfk9l41ZJosCT6kp1pItkccjtcyVyrjn4tzYsvtyw&oe=68705F26,0,0,0,33,8,820,1
1412159289904379,post,https://www.facebook.com/groups/361306988322953/posts/1412159289904379/,انا قدمت عام وقدمت ازهر الاتنين وقبل في عام ونتيجة الأزهر لسه مبانتش فاستني لغاية اما تبان ولا أقدم في عام وبعد كدة اسحب الملف؟؟ عشان لو مقابلش في أزعر ميبقاش الاتنين راحوا عليا في التقديم وملحقش,05/07/2025,42,22,0,1412159289904379,pfbid034C3boPC1yBMcjqpYMFxmZEtBmk6o2ckNgzk6YANkHjE5B6btcv7eQJAaLvsxB8Ffl,Dina Essam,https://www.facebook.com/dina.essam.618697,https://scontent.fsgn23-1.fna.fbcdn.net/v/t39.30808-1/501449439_122209658060057817_1131019968112470801_n.jpg?stp=cp0_dst-jpg_p48x48_tt6&_nc_cat=101&ccb=1-7&_nc_sid=e99d92&_nc_ohc=A4awGWzHNgYQ7kNvwEwrPVd&_nc_oc=AdkU9G4wAYwXaXT9hS_4hnHA3oJRmpdjqqtq2ay0qsK9DVBmngo3BILwurxm3XpFWtE&_nc_zt=24&_nc_ht=scontent.fsgn23-1.fna&_nc_gid=EJL-L9-fG3QXblCyHgx-OQ&oh=00_AfQOX8Q6bMWHTBSR0zZ2vLts3bsNzm4-MOd1LVRxY9dA0w&oe=68706FD4,0,0,0,22,0,0,0
1408924883561153,post,https://www.facebook.com/groups/361306988322953/posts/1408924883561153/,عايزه لينك تقديم الازهر,01/07/2025,35,21,3,1408924883561153,pfbid0231TpJZkpDyu2K6ahjuorjEsmSi78K4JDWmskDQ4Hw4dc9rykuagcQhK7GWh7udu9l,Rehab Moustafa,https://www.facebook.com/rehab.moustafa.39545,https://scontent.fsgn23-1.fna.fbcdn.net/v/t39.30808-1/441400024_1178207249897541_8021608446387985931_n.jpg?stp=cp0_dst-jpg_s48x48_tt6&_nc_cat=103&ccb=1-7&_nc_sid=e99d92&_nc_ohc=UwnIVVTngIAQ7kNvwEe8iGn&_nc_oc=AdlvBJHvnQ4wNx5qd0F4I8S3VCsikvzW1HEV2ZbHpnCudshuQ2YdAGGqRis-HWUtUsk&_nc_zt=24&_nc_ht=scontent.fsgn23-1.fna&_nc_gid=EJL-L9-fG3QXblCyHgx-OQ&oh=00_AfR3zfnHvUckSNCw6Ask1dv_Fs_fJKH8dSe_KwTS6U1xPw&oe=687055E7,0,1,0,20,0,0,0
1791774188040929,post,https://www.facebook.com/groups/1633966240488392/posts/1791774188040929/,"هى اي منحة ال ١٠٠ يوم دى  اللى بيقولوا اتلغت ؟؟
كدة احنا مفروض تقبض اي معاهم ؟؟؟
وامتى هتقبض محافظة قنا مركز قوص؟؟؟",05/07/2025,13,8,0,1791774188040929,1472213627554171,Anonymous participant,,https://scontent.fsgn23-1.fna.fbcdn.net/v/t39.35477-6/480548272_28668883916060800_4666502728748875688_n.jpg?stp=cp0_dst-jpg_s50x50_tt6&_nc_cat=1&ccb=1-7&_nc_sid=ee2d7f&_nc_ohc=Z4vltGhL-q8Q7kNvwE_FlCI&_nc_oc=AdkimZYy8jkTs-SWAPoIuecuJUV0X9KDDf4Pei90wNs0HdrCq8AaQEW3_A9LH4u8oYQ&_nc_zt=14&_nc_ht=scontent.fsgn23-1.fna&_nc_gid=EJL-L9-fG3QXblCyHgx-OQ&oh=00_AfQhDaSTPA8hS0vQ68h9FlPPdq8kb6LInbK9IZQW_GZyPg&oe=68705D79,0,0,0,8,0,0,0
